{
  "schema_version": 1,
  "manifest_id": "VPUB-20260728-example",
  "plan_digest": "95b7eb4a1337bf9f0363ff31cb1195276b8aec757e4a224aa970d2dbe6aab9c8",
  "exported_at": "2026-07-28T00:01:30Z",
  "drive_readback": "verified",
  "files": [
    {
      "path": "Knowledge/Concepts/Flow.md",
      "source_sha256": "aaac82314aa93fed803d3a91b68143043fd2435916e4512ba479921b679d7e0e"
    },
    {
      "path": "Literature/Notes/jackman-2021.md",
      "source_sha256": "72e85452dd6eaeb44c00d22028f86f2d268a1bdc142638ea6d176342c07a2247"
    }
  ]
}
